tweet,Sentiment'
oh please bangalore airport never seen hospitality,Positive
superb hospitality exceptional service alfia noor akasaair bangalore airport check counter,Positive
always pleasure visit lounge bangalore airport thanks mr veer superb hospitality,Positive
unmatched hospitality grace thank taj bangalore airport,Positive
sure back soon must commend excellent lounge bangalore airport warm hospitality,Positive
waiting airport fly kolkata beautiful airport enjoying hospitality longue,Positive
discovered swissness working bangalore airport swiss management zurich airport well documented book swissness nutshell amp even regulation broadest sense refers quality asthethics precision hospitality,Positive
hotels near bangalore airport internation airport road suitably connected international airport road provide premium hospitality services experience elevated stay heart india tech capital housefinch residency bengaluru,Positive
seamless travel exceptional comfort experience pinnacle transit hospitality hotel bangalore biz best choice near bangalore airport recharge relax rejuvenate,Positive
thank kempegowda bangalore airport hospitality cleanliness notjustanairport,Positive
blr lounge bangalore airport waiting board flight best hospitality sirvice given mr nagaraj team best lounge india,Positive
travelled bus route 8 bangalore airport hospitality conductor awesome helpful good service,Positive
domestic lounge bangalore airport cosy place relax work nice facilities food good non spicy healthy nice hospitality staffs,Positive
sharwin thank good hospitality service never got good service hospitality lounge thank bangalore airport,Positive
conveniently located kempegowda international airport road red key airport hotel offers guests welcoming budget friendly hospitality best budget hotel close bangalore airport,Positive
bangalore launch may times never disappointed hospitality kind food serve bangalore airport must check launch special forget say hi sachin treat like family member,Positive
lounge experience good bangalore airport hospitality sreelekshmi good,Positive
really nice experience bangalore airport lounge nice hospitality akshya liked food see bangalore,Positive
experience airport staff pleasant overwhelmed happiness assistance hospitality staff wonderful flight,Positive
indigo best always 6e 6sigma bangalore airport indigo ground staff ms ramya amp shewtha took pains meet amp wife dr hemalatha felicitate us enquire welfare spell bound nectar 6e hospitality thanks,Positive
breaking news thanks govt citizen india providing high profile security hospitality bangalore airport,Positive
front desk girl power margret bangalore airport check gate 17 11th march 2019 thank much kind gesture today appreciate help also indigo airlines hospitality cheers indigo,Positive
thank meet assist hospitality bangalore airport proactive helpful,Positive
one direct partnered plaza premium group ensure efficient passenger interaction bangalore airport,Positive
would like thanks mr manjunath team wonderful hospitality bangalore airport team polite service oriented basically customer centric pandemic efforts mind blowing keep guys,Positive
today traveling bangalore madurai enjoyed service bangalore airport lounge hospitality nice food tasted good enjoyed stay,Positive
bangalore airport lounge ambience hospitality quite good food equally tasty wide stretch including live counters liquors also served payment basis spending time 1 hr extra airport,Positive
short sweet story bangalore airport bored journy turnd journey lot smiles begin hot coffee morning good hospitality uday friend hyd cute wishes nishma bright girl continued good food,Positive
transfer flight wait long bangalore airport must say hospitality blr lounge good especially service jenita lexi arun nice make comfortable,Positive
thank spandana wonderful hospitality service warm behaviour bangalore airport,Positive
Assured Bengaluru Airport transfers class leading hospitality ride motto Love Bengaluru thank,Positive
Enjoying Spicejet hospitality broken armrest airline claims provide comfortable journey,Positive
staff airport local auto rickshaw drivers masses Bangalore polite well mannered,Positive
Hospitality Conrad Bangalore terrible best banquet Managers quips care titbits making run pillar post,Positive
Thank wonderful hospitality service beautiful experience Distance chargers Bengaluru airport Gooty 230 kms,Positive
oh please bangalore airport never seen hospitality,Positive
seamless travel exceptional comfort experience pinnacle transit hospitality hotel bangalore biz best choice near bangalore airport recharge relax rejuvenate l,Positive
superb hospitality exceptional service alfia noor akasaair bangalore airport check counter,Positive
hotels near bangalore airport internation airport road suitably connected international airport road provide premium hospitality services experience elevated stay heart india tech capital housefinch residency bengaluru,Positive
really nice experience bangalore airport lounge nice hospitality akshya liked food see bangalore,Positive
always pleasure visit lounge bangalore airport thanks mr veer superb hospitality,Positive
experience airport staff pleasant overwhelmed happiness assistance hospitality indigo6e staff dhanalakshmi bangalore airport wonderful flight,Positive
bangalore airport lounge ambience hospitality quite good food equally tasty wide stretch including live counters liquors also served payment basis spending time 1 hr extra airport,Positive
lounge experience good bangalore airport hospitality sreelekshmi good,Positive
one direct partnered plaza premium group ensure efficient passenger interaction bangalore airport,Positive
bangalore launch may times never disappointed hospitality kind food serve bangalore airport must check launch special forget say hi sachin treat like family member,Positive
indigo best always 6e 6sigma bangalore airport indigo ground staff ms ramya amp shewtha took pains meet amp wife dr hemalatha felicitate us enquire welfare spell bound nectar 6e hospitality thanks dr nadarajan,Positive
today traveling bangalore madurai enjoyed service bangalore airport lounge hospitality nice food tasted good enjoyed stay,Positive
would like thanks mr manjunath team wonderful hospitality bangalore airport team polite service oriented basically customer centric pandemic efforts mind blowing keep guys,Positive
short sweet story bangalore airport bored journy turnd journey lot smiles begin hot coffee morning good hospitality uday friend hyd cute wishes nishma bright girl continued good food,Positive
domestic lounge bangalore airport cosy place relax work nice facilities food good non spicy healthy nice hospitality staffs,Positive
thank kempegowda bangalore airport hospitality cleanliness,Positive
unmatched hospitality grace thank taj bangalore airport,Positive
blr lounge bangalore airport waiting board flight best hospitality sirvice given mr nagaraj team best lounge india,Positive
transfer flight wait long bangalore airport must say hospitality blr lounge good especially service jenita lexi arun nice make comfortable,Positive
discovered swissness working bangalore airport swiss management zurich airport well documented book swissness nutshell amp even regulation broadest sense refers quality asthethics precision hospitality,Positive
sharwin thank good hospitality service never got good service hospitality lounge thank bangalore airport,Positive
thank meet amp assist hospitality bangalore airport surya proactive helpful,Positive
front desk girl power margret bangalore airport check gate 17 11th march 2019 thank much kind gesture today appreciate help also indigo airlines hospitality cheers indigo,Positive
thank spandana wonderful hospitality service warm behaviour bangalore airport,Positive
thanks govt citizen india providing high profile security hospitality bangalore airport,Positive
travelled bus route 8 bangalore airport hospitality conductor awesome helpful good service,Positive
sure back soon must commend excellent lounge bangalore airport warm hospitality,Positive
waiting fly kolkata beautiful airport enjoying hospitality longue,Positive
